url,title,author,img,date,abstract
https://bnarchives.economicsfromthetopdown.com/id/eprint/798/,From Operation Warp Speed to TRIPS. Vaccines as Assets,Tatiana Andersen,https://bnarchives.economicsfromthetopdown.com/798/1/20220000_andersen_from_operation_warp_speed_to_trips_front.jpg,2022,"This chapter examines the political economy of biopharmaceutical innovation, focusing primarily on vaccines in the Covid-19 pandemic. This analysis aims to make visible the deep entanglements that entrench an extractive and dysfunctional innovation ecosystem, calcifying inequities in global access to essential medicines. The chapter argues that the current inequities in vaccine access are not new or anomalous and that they are the result of a complex yet strategic enmeshment among the logics of war and biomedicine, asset accumulation, and intellectual property. Uneven access to Covid-19 therapeutics can be traced to these three elements, which have built inequity into the political economy of biomedicine long before the current pandemic. The first section in the chapter teases out the first entanglement by unpacking Operation Warp Speed (OWS) as the culmination of a historical war-biomedical nexus driven by the United States, which has important implications for the global political economy of biomedical innovation and North-South asymmetries. The second section places OWS in the broader context of an extractive innovation ecosystem guided by a logic of differential accumulation characterised by the assetisation of publicly funded research. The final section explores how asset accumulation logics and unequal access to therapeutics are embedded in the international architecture of the Intellectual Property Rights (IPRs) regime."
https://bnarchives.economicsfromthetopdown.com/id/eprint/797/,המהפכה המשטרית&quot; וקבוצות ההון הדומיננטיות&quot; (Regime Change and Dominant Capital),Jonathan Nitzan and Shimshon Bichler,https://bnarchives.economicsfromthetopdown.com/797/1/20230900_bn_regime_change_and_dk_hebrew_front.jpeg,2023-09,"המשברים האחרונים בישראל, המכונים בשם אורווליאני טיפוסי &quot;המהפכה המשפטית&quot;, הובילו לשתי תגובות סותרות לכאורה: האחת הייתה של פירמות ההשקעה ומיני כלכלנים ואנליסטים והתגובה השנייה הייתה של נתניהו ומרעיו למה שהם מכנים &quot;רפורמה&quot;. מי צודק? האם צודקים ראשי קבוצות הון דומיננטיות המתריעים מפני &quot;הפגיעה בדמוקרטיה&quot;, &quot;הפרת שיווי המשקל שבין הרשויות&quot;, &quot;הברחת הון סיכון&quot;, &quot;שיבוש היציבות&quot; ושאר מיני אזהרות? או שמא צודקים נתניהו וכנופייתו, המבטיחים שהליברליזציה בישראל משגשגת, שכלכלת ישראל מבוססת על יסודות איתנים ותמשיך לצמוח ובעיקר, כי היא נמצאת בידיים אחראיות ומנוסות. לנו נראה כי שני הצדדים צודקים."
https://bnarchives.economicsfromthetopdown.com/id/eprint/796/,Billionaires are so Predictable,Blair Fix,https://bnarchives.economicsfromthetopdown.com/796/1/20230903_fix_billionaires_are_so_predictable_front.JPG,2023-09-03,"Have you ever wondered what it takes to become a billionaire? Do you need rare genius? Exceptional acumen? Miraculous foresight? An uncompromising work ethic?  On all four counts, the answer is no.  It turns out that to become a billionaire, what you really need is the right social setting. You need to live in a society that is suitably rich and appropriately unequal. Without those things, your chances of wearing the billionaire badge are low.  In this post, I’ll do the math.  Using data from Forbes, I’ll show you how the billionaire headcount varies across countries. Then I’ll show you how to predict this variation. Forget about character traits and personal histories. We don’t need them. To predict how many billionaires a country has, we can get surprisingly far just by knowing the distribution of income."
https://bnarchives.economicsfromthetopdown.com/id/eprint/795/,חשבתי שאטוס לדמשק ואעשה שינוי: אודי אדיב והמהפכה שלא היתה (I Thought I Would Fly to Damascus and Bring Change: Udi Adiv and the Revolution that Never Was),Shimshon Bichler and Jonathan Nitzan,https://bnarchives.economicsfromthetopdown.com/795/1/20230800_bn_i_thought_i_would_fly_to_damascus_front.jpg,2023-08-30,"*** המאמר עבר עיסוי לשוני על ידי העורך: מומלץ לקרוא את הגירסה המקורית ***  בליל חורף קר של שנת 1972 פרצו כעשרים אנשי שב&quot;כ ומשטרה לדירה בהדר הכרמל בחיפה ועצרו את אודי אדיב וחברתו, לאה לשם. כך נפתח ספר הזיכרונות של אודי אדיב, המהפכה שלא הייתה.   זאת הייתה תחילתה של פרשה מתוקשרת אשר הגיעה לשיאה במשפטים שנערכו לחברי &quot;הרשת היהודית-ערבית&quot;, שבסופם אודי אדיב נמצא אשם בין השאר בבגידה ובריגול ונשלח למאסר ממושך של 17 שנה (שהוקלו מאוחר יותר ל-12 שנים).   שרשרת המעצרים ומשפטי הראווה של אודי וחבריו זכו לסיקור יומיומי מנופח מצד כלל אגפי התקשורת הישראלית של אותה תקופה. יש לזכור כי נפלאות התבונה האינטרנטית טרם התגלו, ורשתות המחשבה הלא מגויסת עדיין לא הומצאו. עיקרי התקשורת היו אז עיתונות כתובה, מפלגתית ו&quot;לא מפלגתית&quot;, שלוש תחנות רדיו בבעלות ממשלתית ישירה וערוץ טלוויזיה ממלכתי אחד פטריוטי גאה, שנאשם תדיר על ידי מפלגות הליכוד, המתנחלים והחרדים ב&quot;שמאלנות&quot;. אבל במקרה זה נוצר לראשונה בישראל קונצנזוס חמים מימין וממה שכינו אז שמאל: אדיב וחבריו הינם סמל ומשל לאויבי העם, אוהבי ערבים, קומוניסטים שונאי ישראל. הם תוצאת החינוך המתקדם כביכול של הקיבוצים השמאלנים. הם &quot;תלושים מערכי היהדות&quot; וסובלים מ&quot;שנאה עצמית&quot;. התברר גם שמקור הרעה הוא תנועת &quot;מצפן&quot; הבוגדנית. ממנה צמחו העשבים השוטים.   עד מהרה הפך המשפט למסע הסתה נגד כל דעה המעזה לבקר את עצם מדיניות החוץ והביטחון הישראלית, התוהה אחר מדיניות הכיבוש וההתנחלויות שניהלה אז ממשלת מפלגת העבודה, המטילה ספק בהיסטוריה הציונית הרשמית, או המזכירה חלילה את קיומה של האומה הפלסטינית, שלא לדבר על רמז לניסיון הידברות מדינית עם נציגי התנועות הפוליטיות הפלסטיניות…."
https://bnarchives.economicsfromthetopdown.com/id/eprint/794/,&quot;על חמישים שנות בדידות: ספרו של אודי אדיב &quot;המהפכה שלא הייתה (Fifty Years of Solitude: Udi Adiv's Book &quot;The Revolution that Never Was&quot;),Shimshon Bichler and Jonathan Nitzan,https://bnarchives.economicsfromthetopdown.com/794/1/20230800_bn_fifty_years_of_solitude_front.jpg,2023-08,"בליל חורף קר של שנת 1972 פרצו כעשרים אנשי שב&quot;כ ומשטרה לדירה בהדר הכרמל בחיפה ועצרו את אודי אדיב וחברתו, לאה לשם. כך נפתח ספר הזיכרונות של אודי אדיב, המהפכה שלא הייתה.   זאת הייתה תחילתה של פרשה מתוקשרת אשר הגיעה לשיאה במשפטים שנערכו לחברי &quot;הרשת היהודית-ערבית&quot;, שבסופם אודי אדיב נמצא אשם בין השאר בבגידה ובריגול ונשלח למאסר ממושך של 17 שנה (שהוקלו מאוחר יותר ל-12 שנים).   שרשרת המעצרים ומשפטי הראווה של אודי וחבריו זכו לסיקור יומיומי מנופח מצד כלל אגפי התקשורת הישראלית של אותה תקופה. יש לזכור כי נפלאות התבונה האינטרנטית טרם התגלו, ורשתות המחשבה הלא מגויסת עדיין לא הומצאו. עיקרי התקשורת היו אז עיתונות כתובה, מפלגתית ו&quot;לא מפלגתית&quot;, שלוש תחנות רדיו בבעלות ממשלתית ישירה וערוץ טלוויזיה ממלכתי אחד פטריוטי גאה, שנאשם תדיר על ידי מפלגות הליכוד, המתנחלים והחרדים ב&quot;שמאלנות&quot;. אבל במקרה זה נוצר לראשונה בישראל קונצנזוס חמים מימין וממה שכינו אז שמאל: אדיב וחבריו הינם סמל ומשל לאויבי העם, אוהבי ערבים, קומוניסטים שונאי ישראל. הם תוצאת החינוך המתקדם כביכול של הקיבוצים השמאלנים. הם &quot;תלושים מערכי היהדות&quot; וסובלים מ&quot;שנאה עצמית&quot;. התברר גם שמקור הרעה הוא תנועת &quot;מצפן&quot; הבוגדנית. ממנה צמחו העשבים השוטים.   עד מהרה הפך המשפט למסע הסתה נגד כל דעה המעזה לבקר את עצם מדיניות החוץ והביטחון הישראלית, התוהה אחר מדיניות הכיבוש וההתנחלויות שניהלה אז ממשלת מפלגת העבודה, המטילה ספק בהיסטוריה הציונית הרשמית, או המזכירה חלילה את קיומה של האומה הפלסטינית, שלא לדבר על רמז לניסיון הידברות מדינית עם נציגי התנועות הפוליטיות הפלסטיניות…."
https://bnarchives.economicsfromthetopdown.com/id/eprint/793/,Regime Change and Dominant Capital: Lessons from Israel,Shimshon Bichler and Jonathan Nitzan,https://bnarchives.economicsfromthetopdown.com/793/1/20230800_bn_regime_change_and_dk_recasp_front.JPG,2023-08,"Israel’s ongoing crisis – or ‘judicial coup’ in popular parlance – has elicited two opposite responses. The first comes from global rating agencies, economists and investment strategists who see Israel’s country risk rising. The opposite reaction, by Prime Minister Netanyahu and his acolytes, insists that the ‘coup’ is much ado about nothing, and that the country remains stable and strong as ever. So, who is right?"
https://bnarchives.economicsfromthetopdown.com/id/eprint/792/,상품에서 자산으로: 권력으로서의 자본과 금융의 존재론 (From Commodities to Assets: Capital as Power and the Ontology of Finance),Jesús Suaste Cherizola,https://bnarchives.economicsfromthetopdown.com/792/1/20230331_suaste_cherizola_from_commodities_to_assets_korean_front.jpg,2023-07,"자산은 자본가 계급의 실천 및 사고방식을 형성하는 데 결정적인 개념이다. 하지만 자본 주의에 관한 비판적 분석은 상품교환을 자본주의 분석의 초석이라 승인하는 경향이 있다. 이 논문은 다른 접근법을 취한다. 나는 자산이 자본주의에 대한 과학적 연구를 위한 견고한 출발점을 제공한다고 주장한다. 자산에 대한 분석은 경제적 거래에 대한 일반적 서술을 정 교화할 수 있도록 해주고, 그런 한에서, 자산 분석은 금융 분야를 재개념화하기 위한 기틀 을 마련해줄 수 있다. 이 두 가지 쟁점은 밀접히 연관된다. ‘자산이란 무엇인가’라는 질 문에 대한 답은 ‘금융이란 무엇인가’라는 질문을 해결할 수 있는 좌표를 제공해줄 것이 다.  저자 제수스 수아스테 체리졸라(JesÚs Suaste Cherizola)는 멕시코 푸에블라 오토노마 대학교(Universidad Autónoma de Puebla)에서 박사학위를 받았고, 권력자본 이론을 전공하는 사회학자이다. 저자는 이 논문을 통해 경제학과 사회과학에 새로운 아이디어를 제공한 기여로 2021 CASP Essay Prize를 수상했다. 따라서 제도주의 경제학 현장에서 이 논문이 지니는 학술적 가치가 높은 평가를 받았다고 볼 수 있다.    In this paper, the author analyzes the concept of 'assets', a crucial concept in the practice and mindset of today's capitalist class. In particular, it emphasizes the emerging importance of assets in financialized capitalism by contrasting them with the concept of commodities, which have enjoyed an important place in the analysis of conventional capitalism. Recently, in the critical academia of finance and money in the West, especially in the sociology of finance, the concepts of capitalization and assetization are emerging as a powerful analytical framework that reveals the characteristics of modern capitalism by replacing the existing commercialization and financialization. The paper provides a clear explanation of the concept of asset, capitalization, and capitalization from the perspective of power capital theory. In addition, by emphasizing the difference between commodity exchange and asset trading, which has been presented centering on the existing Marxism, it explains well why the asset type and the process of assetization can be an important analytical framework for studying today's financial capitalism. Therefore, this paper in domestic academia, it can provide impetus to advance the discussion of financialization in terms of capitalization and assetization, and it can also serve as a useful reference point for understanding recent academic discussions on the changes and core of modern capitalism.  Author Jesús Suaste Cherizola is a sociologist who received her Ph.D. from Universidad Autónoma de Puebla, Mexico, and specializes in power capital theory. The author won the 2021 CASP Essay Prize for his contributions to new ideas in economics and social sciences with this paper. Therefore, it can be said that the academic value of this thesis has been highly evaluated in the field of institutional economics."
https://bnarchives.economicsfromthetopdown.com/id/eprint/791/,"Estudiar el precio, olvidar el valor. Una alternativa al pensamiento económico tradicional",Jesús Suaste Cherizola,https://bnarchives.economicsfromthetopdown.com/791/1/20230700_suaste_cherizola_estudiar_el_precio_olvidar_el_valor_front.JPG,2023-07,"RESUMEN. Este artículo intenta sentar las bases para una comprensión de los precios radicalmente diferente a como los entiende el pensamiento económico tradicional. Tras revisar algunos aspectos relevantes de la crítica a la teoría del dinero como mercancía, se muestra que el pensamiento tradicional es incapaz de captar las propiedades irreductibles de los precios y la complejidad de los procesos que determinan las  magnitudes monetarias. La  crítica  del pensamiento tradicional desemboca en un llamado a olvidar el concepto de valor y, en su lugar, elaborar estrategias para entender el funcionamiento de los precios. Siguiendo el trabajo de los economistas Jonathan Nitzan y Shimshon Bichler (2002, 2008), se propone que los cambios en la capacidad de control de los grupos sociales resultan en (y se expresan como) cambios en los niveles relativos de precios. Este desplazamiento permite construir una ontología del orden capitalista que no está fundada en las nociones de equivalencia y valor, sino en las diferencias de poder. Y hace posible reconocer al plano monetario como un fenómeno complejo e irreductible.  ABSTRACT. This article aims to lay the foundations for an understanding of prices radically different from the way they are understood by traditional economic thought. After reviewing some relevant aspects of the critique of the commodity theory of money, it is shown that traditional thought is incapable of grasping the irreducible properties of prices and the complexity of the processes that determine monetary magnitudes. The critique of traditional thinking leads to a call to forget the concept of value and, instead, to develop strategies to understand how prices work in reality. Following the work of economists Jonathan Nitzan and Shimshon Bichler, it is proposed that changes in the level of control of social groups result in (and are expressed as) changes in relative price levels. This shift makes it possible to build an ontology of the capitalist order that is not founded on notions of equivalence and value but on power differentials. And it makes it possible to recognize the monetary plane as a complex and irreducible phenomenon."
https://bnarchives.economicsfromthetopdown.com/id/eprint/790/,Differential Harm: Patterns of Uneven Destruction,Yuri Di Liberto,https://bnarchives.economicsfromthetopdown.com/790/1/20230700_di_liberto_differential%20harm_front.JPG,2023-07,"This essay opposes the idea that contemporary critical events like pandemics, global warming, environmental deterioration, et cetera, are to be considered as affecting humanity in a uniform way. Instead of seeing these phenomena like abstract universal threats, I propose to look at them through the lens of my concept of differential harm. By drawing on interdisciplinary sources, this concept aims at covering a series of processes that are best described in differential, rather than absolute, terms. By the same token, differential harm is a matter of scale. Moreover, this essay also suggests that macroscopic critical processes are better understood as instances of harm, rather than violence. Instead of framing macroscopic disruptive phenomena as simple calamities or crises, my approach also aims at acknowledging their social, political, and psychological dimensions."
https://bnarchives.economicsfromthetopdown.com/id/eprint/789/,Mapping the Ownership Network of Canada’s Billionaire Families,Blair Fix and DT Cochrane,https://bnarchives.economicsfromthetopdown.com/789/1/20230623_fix_cochrane_mapping_the_ownership_network.JPG,2023-06-23,"The planet has a billionaire problem. According to Oxfam, the world’s billionaires have more combined wealth than the bottom 60% of humanity — some 4.6 billion people. Given this obscene situation, calls are growing to rid the world of the billionaire class. But how do we make that happen?  We think that part of the answer is to understand billionaire’s network of control. Many billionaires are happy to have their net worth tracked by Forbes — they treat it as an accumulation horse race.1 But what billionaires don’t like is for people to understand how they wield power. On that front, behind ever billionaire is a complicated network of corporate control — a network that is seldom made public.  We’d like to change that. In this post, we’ll map the ownership network of ten billionaire families in Canada.  Why Canada? Well, because we’re Canadian researchers. But more importantly, because the statistics arm of the Canadian government has done the heavy lifting for us. For the last decade, Statistics Canada has maintained a database on the inter-corporate ownership of Canadian corporations — a database that it bills as a “unique directory of ‘who owns what’ in Canada”.  This corporate-ownership database contains a trove of information about how the rich wield power. In this post, we’ll begin to explore the data by mapping the ownership network of the following billionaire families:      The McCain Family     The Katz Family     The Fidani Family     The Richardson Family     The Saputo Family     The Rogers Family     The Pattison Family     The Irving Family     The Weston Family     The Thomson Family"
https://bnarchives.economicsfromthetopdown.com/id/eprint/788/,"Environmental Conflict, Capital as Power . . . and a Nice Trip to London",Adam Marshall,https://bnarchives.economicsfromthetopdown.com/788/1/20230525_marshall_environmental_conflict_casp_and_a_nice_trip_to_london_front.jpg,2023-05-25,"FROM THE ARTICLE: In my PhD thesis, which I am currently in the process of writing up, I explore the UK fracking conflict as a means of elucidating its political economic drivers and dynamics. In the process, I hope to also shed light on the political economic drivers of socio-ecological conflict and crises more broadly. To achieve these aims, my research combines a novel theory of capitalism – the capital as power (CasP) approach to political economy – with a unique mix of qualitative and quantitative research methods. While my thesis contributes primarily to debates at the intersection of ecological economics and political ecology, it also aims to extend the frontiers of research on CasP."
https://bnarchives.economicsfromthetopdown.com/id/eprint/787/,The Political Economic Roots of Hollywood Strikes (A Series of Blog Posts),James McMahon,https://bnarchives.economicsfromthetopdown.com/787/1/20230500_mcmahon_the_political_economic_roots_of_hollywood_strikes_front.JPG,2023,"FROM PART 1 (pp. 1-4):   This multi-part blog post investigates the timing of strikes in Hollywood. A strike like the 2023 WGA strike makes sense when we have the hindsight to piece together the issues that built up over the years. But is 2023 a particularly ripe year for contract negotiations to break down? If the labour demands are reasonable, why do studios refuse to agree with them? Or why would job security be “unreasonable” at this point in time? How do we reach a point when studios fight against the labour they (theoretically) need to be creative?  FROM PART 2 (pp. 1-5):   From the post: Around the time of this post, the WGA and the Alliance of Motion Picture and Television Producers (AMPTP) produced a tentative agreement in their 2023 negotiations. The WGA Negotiating Committee, the WGAW Board and WGAE Council all voted unanimously to recommend the agreement on September 26, 2023. As mentioned in Part 1, this series of posts looks at strikes in Hollywood over a period of 50 years. I am keen to analyze the 2023 Hollywood strikes in greater detail, but it will be at least a couple of months before published financial reports cover the period of the WGA and SAG-AFTRA strikes in 2023. For now, consider my political economic analysis of strikes in Hollywood to be something that might still apply to what we have witnessed in the last few months. – J  FROM PART 3 (pp. 1-7): Around the time of this post, SAG-AFTRA and the Alliance of Motion Picture and Television Producers (AMPTP) produced a tentative agreement in their 2023 negotiations. The SAG-AFTRA National Board approved the tentative agreement, and recommends for the ratification of the 2023 TV/Theatrical contracts. – J"
https://bnarchives.economicsfromthetopdown.com/id/eprint/786/,Rentiership and Intellectual Monopoly in Contemporary Capitalism: Conceptual Challenges and Empirical Possibilities,Joseph Baines and Sandy Brian Hager,https://bnarchives.economicsfromthetopdown.com/786/1/20230500_baines_hager_rentiership_and_intellectual_monopoly_front.jpg,2023,"The concepts of rentiership and intellectual monopoly have gained increased prominence in discussions about the transformation of global capitalism in recent years. However, there have been few if any attempts to construct measures for rentiership and intellectual monopoly using firm-level financial data. The absence of such work, we argue, is symptomatic of conceptual challenges in delineating what precisely qualifies as rent, intellectual or otherwise. In place of static conceptions of rent and intellectual monopoly, we develop a dynamic framework for analyzing the processes of rentierization and intellectual monopolization and apply this framework to the analysis of the transformation of non-financial firms in the United States since the 1950s. We find that the timing and intensity of rentierization and intellectual monopolization differs significantly across sector and firm size and is heavily mediated by the uneven ramifications of government policy across companies and industries. Overall, our framework illuminates the variegated landscape of corporate power in the US, and offers a useful guide for critically interrogating rentierization and intellectual monopolization in other contexts."
https://bnarchives.economicsfromthetopdown.com/id/eprint/785/,All You Need to Know About Climate Change,Yuri Di Liberto,https://bnarchives.economicsfromthetopdown.com/785/1/20230519_di_liberto_all_you_need_to_know_about_climate_change_front.JPG,2023-05-19,"What if I told you that they knew everything? And that they have known it for a very long time? On January 13 of this year, 2023, in the journal Science, perhaps the most important article to date on climate change was published. In political, social, and ethical terms, this article represents the equivalent of a nuclear bomb, despite the fact that (as is sadly obvious to expect) no one in mainstream news channels (and very few in academia) has mentioned it."
