url,title,author,img,date,abstract
https://bnarchives.economicsfromthetopdown.com/id/eprint/771/,"Global Capital: Political Economy of Capitalist Power (YorkU, GS/POLS 6285 3.0, Graduate, Fall Term, 2022-23)",Jonathan Nitzan,https://bnarchives.economicsfromthetopdown.com/771/1/nitzan_y6285_00_syllabus_2022_23_front.JPG,2022,"DESCRIPTION  What is capital? Despite centuries of debate, there is no clear answer to this question – and for a good reason. Capital is a polemic term. The way we define it attests our theoretical biases, ideological disposition, view of politics, class consciousness, social position, and more.  Is capital the same as machines, or is it merely a financial asset? Is it a material article or a social process? Is it a static substance or a dynamic entity? The form of capital, its existence as monetary wealth, is hardly in doubt. The problem is with the content, the stuff that makes capital grow – and on this issue there is no agreement whatsoever. For example, does capital accumulate because it is productive, or due to the exploitation of workers? Does capital expand from within capitalism, or does it need non-capitalist institutions like the state and other external forces? Is accumulation synonymous with economic growth, or can capital expand by damaging production and undermining efficiency? What exactly is being accumulated? Does the value of capital represent utility, abstract labour – or perhaps something totally different, such as power or force? What units should we use to measure its accumulation?  Surprisingly, these questions remain unanswered; in fact, with the victory of liberalism, most of them are no longer being asked. However, the silence is incomplete. As crisis and social strife intensify, the questions resurface. The accumulation of capital is the central process of capitalism, and unless we can clarify what that process means, we remain unable to understand our world, let alone change it.  The seminar has two related goals: substantive and pedagogical. The substantive purpose is to tackle the question of capital head on. The course explores a spectrum of liberal and Marxist theories, ideologies and dogmas – as well as a radical alternative to these views. The argument is developed theoretically, historically and empirically. The first part of the seminar provides a critical overview of political economy, examining its historical emergence, triumph and eventual demise. The second part deals with the two ‘materialistic’ schools of capital – the liberal theory of utility and the Marxist theory of labour time – dissecting their structure, strengths and limitations. The third part brings power back in: it analyses the relation between accumulation and sabotage, studies the institutions of the corporation and the state and introduces a new framework – the capitalist mode of power. The fourth and final part offers an alternative approach – the theory of capital as power (or CasP for short) – and illustrates how this approach can shed light on conflict-ridden processes such as corporate merger, stagflation, imperialism and the new wars of the late twentieth and early twenty-first centuries.  Pedagogically, the seminar seeks to prepare students toward conducting their own independent re-search. Students are introduced to various electronic data sources, instructed in different methods of analysis and tutored in developing their empirical research skills. As the seminar progresses, these skills are used both to assess various theories and to develop the students’ own theoretical/empirical research projects."
https://bnarchives.economicsfromthetopdown.com/id/eprint/770/,"Political Economy of Capital Accumulation (YorkU, LAPS/POLS 4292 6.0, Undergraduate, Fall Term, 2022-23)",Jonathan Nitzan,https://bnarchives.economicsfromthetopdown.com/770/1/nitzan_y4292_00_syllabus_2022_23_front.JPG,2022,"DESCRIPTION AND OBJECTIVES. Capital is the central power institution of capitalism: iCapital is the central power institution of capitalism: it is the main force underlying the relentless transformation of power relations in capitalist societies. The course explores the accumulation of capital from three interrelated perspectives: conceptual, historical and empirical. At the conceptual level, the course examines the evolution of orthodox and critical theories of value and how these theories serve to explain and justify contending notions of accumulation. At the historical level, it traces the development of capital from its humble pre-capitalist origins to its present world dominance. At the empirical level, it studies and juxtaposes the qualitative and quantitative aspects of capital accumulation and explores what they mean for the contemporary political economy. In parallel to these explorations, the course introduces students to the art and science of empirical research. By the end of the course, students are expected to be able to develop and integrate theoretical arguments with their own empirical work."
https://bnarchives.economicsfromthetopdown.com/id/eprint/769/,Interest Rates and Inflation: Knives Out,Blair Fix,https://bnarchives.economicsfromthetopdown.com/769/1/20230219_fix_interest_rates_and_inflation_knives_out_front.png,2023-02-19,"If you’re just tuning in, I’ve spent the last few months debunking some common misconceptions about inflation:  Is inflation a uniform increase in prices? No. Inflation is wildly differential.  Is inflation driven by an ‘over-heated’ economy? No. Inflation tends to come with economic stagnation.  Do higher interest rates reduce inflation? No. Higher interest rates are associated with higher inflation.  As expected, the last claim put mainstream economists into war mode. You see, the belief that interest rates down-regulate inflation has come to be sacred. So by scrutinizing this idea with evidence, I was effectively torching an effigy of the pope. (Novelist Cory Doctorow helped fan the flames by writing an incendiary essay about my research.) And so I spent a ‘fun’ week on Twitter being bombarded by econo-scorn.  Now back to science. When I published ‘A Test of Monetary Faith’, I had more evidence in the pipelines — evidence that debunks the idea that interest rates down-regulate inflation. In this post, I’ll wade through the data.  The take-home message is clear: when we look at the World Bank database, there is no evidence that higher interest rates down-regulate inflation. If anything, the evidence suggests that rate hikes make inflation worse.  But before we get to the data, I’ll respond to some of the more cogent criticisms that economist hurled my way."
https://bnarchives.economicsfromthetopdown.com/id/eprint/768/,"Kapitał, by rządzić, musi sabotować postęp",Mateusz Pietryka,https://bnarchives.economicsfromthetopdown.com/768/1/20230210_petryka_kapital_by_rzadzic_musi_sabotowac_postep_front.jpg,2023-02-10,"Od głodu i biedy po zwykłe marnotrawstwo i nawracające fale przeróżnych kryzysów – to nie niepożądane skutki uboczne kapitalizmu, ale przejawy sabotażu. Bo nic nie utrwala władzy kapitału skuteczniej niż istnienie szerokiej rzeszy ludzi, którzy ani na chwilę nie mogą przestać pracować, by przeżyć."
https://bnarchives.economicsfromthetopdown.com/id/eprint/767/,Do High Interest Rates Reduce Inflation? A Test of Monetary Faith,Blair Fix,https://bnarchives.economicsfromthetopdown.com/767/1/20230204_fix_do_high_interest_rates_reduce_inflation_front.JPG,2023-02-04,"Whenever inflation rears its head, the call soon comes to raise interest rates. The rationale is simple. Higher interest rates put a damper on the supply of money. And this monetary clamp slows inflation. It’s so intuitive that it must be true.  Or is it?  As the Reverend Brooke observes, it takes a person of true conviction to ignore apparent contradictions. As such, this post is designed to test your monetary faith. According to monetary orthodoxy, higher interest rates reduce inflation. Yet the evidence demonstrates that the opposite is true: higher interest rates are associated with higher inflation. With this evidence in mind, I invite you to read on. Put your monetary faith to the fire and see if it can survive."
https://bnarchives.economicsfromthetopdown.com/id/eprint/766/,"Capitalism, Money and Inequality in the World",Tim Di Muzio,https://bnarchives.economicsfromthetopdown.com/766/1/20230000_di_muzio_capitalism_money_and_inequality_in_the_world_front.png,2023,"There is little doubt that, in the last hundred years or so, progress has been made in lifting more people out of extreme poverty. Yet, considerable economic inequalities both within and between nations persists and, as recent work has shown, if the rate of return on capital surpasses the rate of growth, inherited wealth will grow faster than earned wealth.  Together, these inequalities contribute to radically different life chances for people around the world. For some it means multiple mansions, private jets, hundred-foot yachts and access to life-saving technologies, while for a substantial portion of humanity it means a daily struggle just to survive or maintain a livelihood.  However, why this radical inequality exists is not altogether clear and is much debated in the academic literature and popular press. Moreover, some view economic inequality as natural and beneﬁcial since it is reasoned that the less well-off will want to emulate the wealthy and thus work harder to achieve their goals. However, is gross inequality rooted in human nature or is it the result of certain ways of organizing society and certain policy choices regarding the human economy?   While it cannot possibly canvass the enormous literature on capitalism, money and inequality, this chapter will suggest that it is the latter by considering the important relationship between capitalism and money to explain the persistence of economic inequality in our world. The chapter also asks what can be done to lessen global economic inequalities once we gain a deeper appreciation of the relationship between capitalism, money and inequality. I will argue that it is too often forgotten that, while economic growth over the last three centuries has lifted many people out of extreme poverty, that capitalism is primarily an economic, monetary and accounting system whose very aim is to generate income and wealth inequality, not level the economic playing ﬁeld.   To explore this argument and examine potential solutions to lessening ﬁnancial inequality, this chapter is divided into three main sections. In the ﬁrst section, the chapter provides an explanation for the historical rise of capitalism, what constitutes capitalism as a speciﬁc politico–economic system and how economically unequal our world is today. In the second part of this chapter, a theoretical analysis of how we might consider the relationship between capitalism, money and inequality is developed. In the ﬁnal section, the chapter explores what is to be done about economic inequality from both mainstream and radical perspectives and argues that there are indeed some plausible public policy initiatives that would work towards achieving objective 10 of the Sustainable Development Goals (SDGs).  Licensee MDPI, Basel, Switzerland. This article is an open access article distributed under the terms and conditions of the Creative Commons Attribution (CC BY) license (http://creativecommons.org/licenses/by/4.0/)."
https://bnarchives.economicsfromthetopdown.com/id/eprint/765/,"The Church of Economics: 'Capital and its Crisis', a Book by Shimshon Bichler and Jonathan Nitzan (כנסיית בתי הספר לכלכלה: בעקבות הספר 'ההון ושברו' מאת שמשון ביכלר ויהונתן ניצן)",Shir Hever,https://bnarchives.economicsfromthetopdown.com/765/1/20230129_hever_the_church_of_economics_front.jpg,2023-01-29,"FROM THE REVIEW:  שמשון ביכלר ויהונתן ניצן פרסמו באחרונה את ספרם &quot;ההון ושברו&quot; (פרדס, 2022, 602 עמ'), בו הם דנים במשותף בתהפוכות כלכליות ותיאורטיות עדכניות. הספר ראה אור כעשרים שנה לאחר שספרם &quot;מרווחי מלחמה לדיווידנדים של שלום&quot;  הכה גלים בחוגים הביקורתיים בישראל.  בעשרים השנים האחרונות פרסמו ביכלר וניצן כמה ספרים ועשרות מאמרים באנגלית. בין השאר, ייסדו באוניברסיטת יורק בטורונטו אסכולה כלכלית חדשה, אשר עוררה דיונים סוערים בקרב כלכלנים ברחבי העולם. למרות ששורשי המחקר האמפירי של ביכלר וניצן נטועים בכלכלה הישראלית , בישראל דווקא לא שמעו על מחקרם. הספר החדש בעברית הוא אפוא קריאת חובה עבור כלכלנים ביקורתיים.  מדובר בספר מאתגר לקריאה. סגנון הכתיבה הציני ואף הלעגני של ביכלר וניצן לא מתחנף לקוראים. כדי להבין את הספר נדרשת מידה ניכרת של צניעות וסבלנות, וגם גישה נכונה – יש לקרוא אותו כרומן בלשי .הספר אינו מספק תשובה לתעלומה, אלא מלמד את מלאכת הבילוש. באמצעות 82 תרשימים המבטאים מחקר אמפירי בן עשורים, מזמין הספר את הקורא לפענח את נתוני הכלכלה ולהסיק מסקנות בעצמו.   מחציתו הראשונה של הספר היא ביקורת נוקבת על תיאוריות כלכליות קיימות. קריאת 300 העמודים הראשונים תבטיח לכל סטודנט לכלכלה בישראל ציון 100 בכל קורס מבוא (את המתמטיקה והסטטיסטיקה עליו ללמוד בכל זאת). זאת בתנאי שיצליח להתגבר על תחושת הקבס העולה כאשר מורדת המסיכה מפניה של הכלכלה הניאו-קלסית השמרנית. קוראים שמאליים ייהנו מאוד מהביקורת על הכלכלה השמרנית, אך גם להם צפויה הפתעה לא נעימה: הספר מפנה ביקורת גם כלפי הכלכלה המרקסיסטית, ומנסה להפריך ביסודיות את עיקריה. גם כאן משתמש הספר באותה דקדקנות מדעית, אך גם צינית ולעגנית, שבעזרתה הוא מבקר את הכלכלה הניאו-קלאסית.  חלקו השני של הספר מציג תיאוריה כלכלית מורכבת, הבנויה על כלכלה פוליטית מוסדית מבית מדרשו של תורסטין ובלן. נוסף לכך, שזורים בו ניתוחים מרקסיסטים של סוויזי, קלצקי, ברן ועוד רבים. התיאוריה נבנית בהדרגה בעזרת ניתוח כלכלי-פוליטי של נתונים אמפיריים. בדרך מוצעים כלים לניתוח ואף חיזוי מגמות כלכליות. ביכלר וניצן חוקרים את ההון ככוח. הם מנתחים את המבנה והתפקוד של תאגידי הענק, הממשלות וציבור המשקיעים העשירים. הספר חושף את האסטרטגיות של השחקנים הגדולים והחזקים ביותר בכלכלה העולמית – הם מתחרים זה בזה, אך גם משתפים פעולה; הם מייצרים ציות וכניעות בקרב הציבור הרחב, אך מוכנים להסתכן בהתרת הרסן כדי להתמודד עם משברים."
https://bnarchives.economicsfromthetopdown.com/id/eprint/764/,The Cause of Stagflation,Blair Fix,https://bnarchives.economicsfromthetopdown.com/764/1/20230126_fix_the_cause_of_stagflation_front.jpg,2023-01-26,"In my last post, I looked at the relation between economic growth and inflation. As per usual, the evidence didn’t sit well with mainstream economics.  According to standard theory, there is a trade off between low inflation and high economic growth. The idea is that you can have one or the other, but not both. So if you want to keep inflation low, you have to ‘cool off’ the economy by slowing economic growth. (Like many things in economics, this idea comes from the totem of supply and demand.)  The trouble is, the empirical evidence shows that the opposite is true. Rather than being driven by ‘excessive’ economic growth, inflation tends to come during periods of stagnation. So despite what mainstream economists proclaim, there is little evidence for a ‘growth-inflation trade off’. Instead, ‘stagflation’ seems to be the norm.  Now, the question is why?  Soon after I published ‘Is Stagflation the Norm?’ several readers pointed out that I should take a look at causation. The idea is that we want to know what drives what. Does (low) inflation drive (high) economic growth? Or does (low) economic growth drive (high) inflation?  Well, I’ve done the math, and the results may surprise you. But before we get there, let’s take a look at what the theory of capital as power has to say about the causes of inflation."
https://bnarchives.economicsfromthetopdown.com/id/eprint/763/,Capitalizing a Cure. How Finance Controls the Price and Value of Medicines,Victor Roy,https://bnarchives.economicsfromthetopdown.com/763/1/2023_roy_capitalizing_a_cure_front.jpg,2023,"Capitalizing a Cure takes readers into the struggle over a medical breakthrough to investigate the power of finance over business, biomedicine, and public health. When curative treatments for hepatitis C launched in 2013, sticker shock over their prices intensified the global debate over access to new medicines. Weaving historical research with insights from political economy and science and technology studies, Victor Roy demystifies an oft-missed dynamic in this debate: the reach of financialized capitalism into how medicines are made, priced, and valued.  Roy’s account moves between public and private labs, Wall Street and corporate board rooms, and public health meetings and health centers to trace the ways in which curative medicines became financial assets dominated by strategies of speculation and extraction at the expense of access and care. Provocative and sobering, this book illuminates the harmful impact of allowing financial markets to determine who heals and who suffers and points to the necessary work of building more equitable futures."
